{
  "book": "cars",
  "chapter": 1,
  "chapter_title": "Introduction to CARS and Active Reading",
  "questions": [
    {
      "id": "cars-01-001",
      "question_text": "The primary purpose of the CARS section is to assess:",
      "options": ["A. Scientific knowledge", "B. Critical analysis and reasoning skills", "C. Writing ability", "D. Memorization capacity"],
      "correct_answer": "B",
      "explanation": "CARS (Critical Analysis and Reasoning Skills) tests the ability to comprehend, analyze, and reason about complex texts rather than testing specific content knowledge.",
      "concept_tags": ["CARS overview", "test purpose", "critical thinking"],
      "difficulty": "easy"
    },
    {
      "id": "cars-01-002",
      "question_text": "Active reading differs from passive reading in that active reading involves:",
      "options": ["A. Reading faster", "B. Engaging with and questioning the text", "C. Highlighting everything", "D. Reading multiple times"],
      "correct_answer": "B",
      "explanation": "Active reading involves engaging with the text through questioning, predicting, summarizing, and connecting ideas rather than passively absorbing information.",
      "concept_tags": ["active reading", "reading strategies", "engagement"],
      "difficulty": "easy"
    },
    {
      "id": "cars-01-003",
      "question_text": "When encountering an unfamiliar word in a CARS passage, the best strategy is to:",
      "options": ["A. Skip the word entirely", "B. Use context clues to infer meaning", "C. Stop reading to look it up", "D. Assume it's not important"],
      "correct_answer": "B",
      "explanation": "Context clues from surrounding sentences often reveal word meaning. The MCAT expects you to use contextual inference rather than prior vocabulary knowledge.",
      "concept_tags": ["vocabulary", "context clues", "inference"],
      "difficulty": "easy"
    },
    {
      "id": "cars-01-004",
      "question_text": "The 'main idea' of a passage refers to:",
      "options": ["A. The first sentence", "B. The central argument or thesis the author is presenting", "C. Every detail in the passage", "D. The conclusion only"],
      "correct_answer": "B",
      "explanation": "The main idea is the central thesis or overarching argument that unifies the passage. Details support this main idea.",
      "concept_tags": ["main idea", "thesis", "central argument"],
      "difficulty": "easy"
    },
    {
      "id": "cars-01-005",
      "question_text": "CARS passages are typically drawn from which disciplines?",
      "options": ["A. Only natural sciences", "B. Humanities and social sciences", "C. Only philosophy", "D. Mathematics and statistics"],
      "correct_answer": "B",
      "explanation": "CARS passages come from humanities (philosophy, ethics, arts, literature) and social sciences (sociology, psychology, economics, political science).",
      "concept_tags": ["passage topics", "humanities", "social sciences"],
      "difficulty": "easy"
    },
    {
      "id": "cars-01-006",
      "question_text": "When reading a CARS passage, you should pay particular attention to:",
      "options": ["A. Names and dates only", "B. The author's tone, purpose, and argument structure", "C. Scientific formulas", "D. Statistical data"],
      "correct_answer": "B",
      "explanation": "Understanding the author's perspective, purpose, and how they structure their argument is crucial for answering CARS questions correctly.",
      "concept_tags": ["author's purpose", "tone", "argument structure"],
      "difficulty": "easy"
    },
    {
      "id": "cars-01-007",
      "question_text": "Identifying the author's tone helps you understand:",
      "options": ["A. Only the vocabulary used", "B. The author's attitude toward the subject matter", "C. The passage length", "D. Historical context only"],
      "correct_answer": "B",
      "explanation": "Tone reveals the author's attitude (critical, supportive, neutral, skeptical, etc.) which helps interpret their argument and answer questions about their perspective.",
      "concept_tags": ["tone", "author's attitude", "interpretation"],
      "difficulty": "easy"
    },
    {
      "id": "cars-01-008",
      "question_text": "A passage with words like 'clearly,' 'obviously,' and 'undoubtedly' suggests the author is:",
      "options": ["A. Uncertain about their claims", "B. Confident and assertive about their position", "C. Presenting opposing views", "D. Being purely objective"],
      "correct_answer": "B",
      "explanation": "Words like 'clearly' and 'obviously' indicate confidence and assertiveness. The author is presenting their position as self-evident or strongly supported.",
      "concept_tags": ["tone indicators", "confidence", "word choice"],
      "difficulty": "medium"
    },
    {
      "id": "cars-01-009",
      "question_text": "Transition words like 'however,' 'nevertheless,' and 'although' typically signal:",
      "options": ["A. Agreement with previous point", "B. A contrast or shift in direction", "C. Additional supporting evidence", "D. A conclusion"],
      "correct_answer": "B",
      "explanation": "These contrast transitions indicate the author is about to present an opposing idea, qualification, or shift from what was previously stated.",
      "concept_tags": ["transitions", "contrast", "text structure"],
      "difficulty": "easy"
    },
    {
      "id": "cars-01-010",
      "question_text": "Transition words like 'moreover,' 'furthermore,' and 'additionally' signal:",
      "options": ["A. Contrast", "B. Continuation or additional support", "C. Conclusion", "D. Cause and effect"],
      "correct_answer": "B",
      "explanation": "These additive transitions indicate the author is providing additional evidence or points that support their argument.",
      "concept_tags": ["transitions", "addition", "support"],
      "difficulty": "easy"
    },
    {
      "id": "cars-01-011",
      "question_text": "When an author uses 'some scholars argue' or 'critics contend,' they are likely:",
      "options": ["A. Agreeing with those scholars", "B. Presenting a view they may challenge or qualify", "C. Stating their own view", "D. Summarizing the passage"],
      "correct_answer": "B",
      "explanation": "Attributing views to others often sets up a position the author will respond to, either agreeing, disagreeing, or qualifying it.",
      "concept_tags": ["attribution", "opposing views", "argument structure"],
      "difficulty": "medium"
    },
    {
      "id": "cars-01-012",
      "question_text": "The purpose of rhetorical questions in a passage is typically to:",
      "options": ["A. Confuse the reader", "B. Emphasize a point or engage the reader", "C. Ask for reader response", "D. Show uncertainty"],
      "correct_answer": "B",
      "explanation": "Rhetorical questions are used for emphasis or to engage readers in thinking about a point the author considers obvious or important.",
      "concept_tags": ["rhetorical questions", "emphasis", "engagement"],
      "difficulty": "medium"
    },
    {
      "id": "cars-01-013",
      "question_text": "Reading the first and last sentences of each paragraph during initial reading helps you:",
      "options": ["A. Skip important content", "B. Quickly grasp the main idea and structure", "C. Avoid the details entirely", "D. Read faster without comprehension"],
      "correct_answer": "B",
      "explanation": "Topic sentences (often first) and concluding sentences (often last) frequently contain the paragraph's main point, helping you understand passage structure.",
      "concept_tags": ["reading strategy", "paragraph structure", "efficiency"],
      "difficulty": "easy"
    },
    {
      "id": "cars-01-014",
      "question_text": "When a CARS passage presents multiple viewpoints, it is important to:",
      "options": ["A. Focus only on the author's view", "B. Track which ideas belong to whom", "C. Ignore attributed views", "D. Assume all views are the author's"],
      "correct_answer": "B",
      "explanation": "Questions often ask about specific viewpoints, so distinguishing between the author's views and views they're reporting or critiquing is essential.",
      "concept_tags": ["multiple viewpoints", "attribution", "reading comprehension"],
      "difficulty": "medium"
    },
    {
      "id": "cars-01-015",
      "question_text": "The scope of a passage refers to:",
      "options": ["A. Its word count", "B. The boundaries of what the passage addresses", "C. The author's credentials", "D. Publication date"],
      "correct_answer": "B",
      "explanation": "Scope defines what the passage does and doesn't address. Understanding scope helps avoid answer choices that go beyond what the passage actually discusses.",
      "concept_tags": ["scope", "boundaries", "passage limits"],
      "difficulty": "medium"
    },
    {
      "id": "cars-01-016",
      "question_text": "An answer choice that is 'out of scope' means it:",
      "options": ["A. Is too short", "B. Addresses something not covered in the passage", "C. Uses difficult vocabulary", "D. Is grammatically incorrect"],
      "correct_answer": "B",
      "explanation": "Out of scope answer choices introduce ideas, claims, or topics that the passage doesn't address, making them incorrect regardless of their truth in the real world.",
      "concept_tags": ["out of scope", "answer evaluation", "test strategy"],
      "difficulty": "medium"
    },
    {
      "id": "cars-01-017",
      "question_text": "When reading CARS passages, you should NOT:",
      "options": ["A. Identify the main idea", "B. Bring in outside knowledge to evaluate truth", "C. Note the author's tone", "D. Track the argument structure"],
      "correct_answer": "B",
      "explanation": "CARS tests comprehension of the passage itself. Outside knowledge about the topic should not be used to evaluate claims—only what's in the passage matters.",